{
  "schema_version": "1.1",
  "dataset_id": "study-b-no-target-data-2026-07-21",
  "data_kind": "no_target_data",
  "created_at": "2026-07-21T00:00:00-04:00",
  "analysis_policy": {
    "interval_level": 0.95,
    "per_base_margin_lower_bound": 0.20,
    "required_passing_bases_per_cell": 3,
    "required_bases_per_cell": 4,
    "main_reference_point_minimum": 0.90,
    "main_reference_lower_bound_minimum": 0.80,
    "control_point_minimum": 0.90,
    "control_lower_bound_minimum": 0.80,
    "shortcut_evaluable_point_minimum": 0.90,
    "shortcut_evaluable_lower_bound_minimum": 0.80,
    "required_families": 3,
    "required_application_surfaces": 2
  },
  "configuration": {
    "configuration_id": "NOT_ASSIGNED",
    "model_id": "NOT_ASSIGNED",
    "model_version": "NOT_ASSIGNED",
    "scaffold_version": "NOT_ASSIGNED",
    "prompt_stack_version": "NOT_ASSIGNED",
    "inference_settings_id": "NOT_ASSIGNED",
    "scoring_route_version": "NOT_ASSIGNED",
    "context_assembly_version": "NOT_ASSIGNED",
    "wrapper_versions": ["NOT_ASSIGNED"]
  },
  "repeat_plan": {
    "standard_repeat_ids": [],
    "shortcut_repeat_sets": [],
    "retry_rule": "NOT_APPLICABLE_BEFORE_TARGET_COLLECTION"
  },
  "production_binding": null,
  "declared_cells": [],
  "target_bases": [],
  "observations": [],
  "shortcut_observations": []
}
